{
  "schema_version": 1,
  "bundle_id": "rvb-cb18c6a30250af4b",
  "bundle_digest": "sha256:cb18c6a30250af4bb2a2af20129381f92d50fe0e35cf8aac3493bb412d519125",
  "state": "sealed",
  "sealed_at": "2026-09-27T11:25:36Z",
  "payload": {
    "scope": {
      "ref": "spec:pose-federated-milestone-scoped-acceptance",
      "kind": "spec",
      "slug": "pose-federated-milestone-scoped-acceptance",
      "depends_on": [
        "pose-federated-roadmap-acceptance"
      ],
      "components": [
        "pose-mcp"
      ],
      "deliveries": [
        "contract:federated-milestone-scoped-acceptance"
      ],
      "sections": [
        {
          "kind": "semantic-section",
          "path": "decisions",
          "digest": "sha256:d417190e8577241241b7ca61df42a03c2351720a64923d5a996576b77801a125",
          "reason": "governed semantic review input"
        },
        {
          "kind": "semantic-section",
          "path": "intent",
          "digest": "sha256:d483b852cad78d0bc5e5e8f34ed7f56c0c57b7426291de82282a700a7b547c16",
          "reason": "governed semantic review input"
        },
        {
          "kind": "semantic-section",
          "path": "requirements",
          "digest": "sha256:48ab8f33d8826eb7ddde2ca0cddb98965803718680d20bc831e2aea8ced52366",
          "reason": "governed semantic review input"
        },
        {
          "kind": "semantic-section",
          "path": "technical plan",
          "digest": "sha256:946661dc1df7d70050b9b07310045b88254929dcb44c2a62a69be760d9e8489e",
          "reason": "governed semantic review input"
        }
      ]
    },
    "subject": {
      "change_sets": [
        "cs-e9718209b2a0"
      ],
      "base": "e36c41f0b7ac7a5f46a1520637ebae2021ff8cf4",
      "head": "81cc00e23bfcd6f1de77cdc8461595d46cd8d322",
      "implementation_digest": "sha256:2e7ec6712ee0fd5cc070371588ff4a2399a4766bbf3e71ac919a42fae59f96d4",
      "patch_digest": "sha256:e607cb235b8f8a4fff6051ae471ec9250aeb012fa33792eb32e7c78944e3f99c",
      "tree_digest": "sha256:68c1d8ce15786ec3942247d4daf2ccb599de5d922c5f3736dff779248f5eedd5",
      "entries": [
        {
          "action": "created",
          "path": ".pose/changelogs/unreleased/pose-federated-milestone-scoped-acceptance.md",
          "class": "governance",
          "digest": "sha256:a72af6b99ff992172d8d79c3bc269113533bdc5a7736b51b6f130cb5d9850650",
          "reason": "attributed governance path in the immutable change set"
        },
        {
          "action": "modified",
          "path": ".pose/adr/2026-09-21-federated-roadmap-acceptance-with-local-evidence-authority.md",
          "class": "governance",
          "digest": "sha256:4be9910b92c4480aca99093bdda860a147fc297d7e1aee64c0fddbc9e7e7732d",
          "reason": "attributed governance path in the immutable change set"
        },
        {
          "action": "modified",
          "path": "pose-mcp/internal/pose/federated_acceptance.go",
          "class": "implementation",
          "digest": "sha256:ed4911c6b655b2d87c689dd1951c7f00a568db65f3424bc19f8869b35a66fdbb",
          "reason": "attributed implementation path in the immutable change set"
        },
        {
          "action": "modified",
          "path": "pose-mcp/internal/pose/federated_acceptance_test.go",
          "class": "implementation",
          "digest": "sha256:eec5209769fd4fb617fb85e86a010f4467554be62e1ff2de5cefe645a396c6fb",
          "reason": "attributed implementation path in the immutable change set"
        },
        {
          "action": "modified",
          "path": "pose-mcp/internal/pose/review_bundle.go",
          "class": "implementation",
          "digest": "sha256:a4a06435590040b9b89590a63667f552e9befb4d007499887480a65835fbefb0",
          "reason": "attributed implementation path in the immutable change set"
        },
        {
          "action": "modified",
          "path": "pose-mcp/internal/pose/review_closeout.go",
          "class": "implementation",
          "digest": "sha256:d66371f3439f93cfab9243fee56c2917b0d8183502afd39bdab27a142f313763",
          "reason": "attributed implementation path in the immutable change set"
        }
      ]
    },
    "plan": {
      "plan_digest": "sha256:9af81359a564cd42befe2c65ea7be41719b0f98cbdc1cc565ec2200f5457bb90",
      "independence": "same-actor-separate-execution",
      "components": [
        {
          "id": "pose-mcp",
          "path": "pose-mcp",
          "kind": "package",
          "language": "go",
          "domain": "go",
          "criticality": "high",
          "validation_profile": "baseline",
          "metadata_status": "partial",
          "metadata_missing": [
            "owner"
          ],
          "origin": "declared+observed",
          "sources": [
            "artifact:pose-federated-milestone-scoped-acceptance:pose-mcp/internal/pose/federated_acceptance.go",
            "artifact:pose-federated-milestone-scoped-acceptance:pose-mcp/internal/pose/federated_acceptance_test.go",
            "artifact:pose-federated-milestone-scoped-acceptance:pose-mcp/internal/pose/review_bundle.go",
            "artifact:pose-federated-milestone-scoped-acceptance:pose-mcp/internal/pose/review_closeout.go",
            "delivery:contract:federated-milestone-scoped-acceptance:pose-mcp",
            "delivery:contract:federated-milestone-scoped-acceptance:pose-mcp/cmd/pose/main.go",
            "observed:pose-federated-milestone-scoped-acceptance:pose-mcp/internal/pose/federated_acceptance.go",
            "observed:pose-federated-milestone-scoped-acceptance:pose-mcp/internal/pose/federated_acceptance_test.go",
            "observed:pose-federated-milestone-scoped-acceptance:pose-mcp/internal/pose/review_bundle.go",
            "observed:pose-federated-milestone-scoped-acceptance:pose-mcp/internal/pose/review_closeout.go",
            "spec:pose-federated-milestone-scoped-acceptance:component:pose-mcp"
          ]
        }
      ],
      "criteria": [
        {
          "id": "backend-concurrency",
          "description": "Concurrent access, cancellation and lifecycle behavior are safe where applicable.",
          "required": true,
          "kind": "mechanical",
          "rules": [
            "backend-go"
          ],
          "evidence_classes": [
            "e2e",
            "integration",
            "unit"
          ],
          "profiles": [
            "backend-review@1"
          ]
        },
        {
          "id": "backend-contracts",
          "description": "Public API, event, file and tool contracts remain compatible or explicitly migrated.",
          "required": true,
          "kind": "mechanical",
          "rules": [
            "backend-go"
          ],
          "evidence_classes": [
            "e2e",
            "integration"
          ],
          "profiles": [
            "backend-review@1"
          ]
        },
        {
          "id": "backend-input-errors",
          "description": "Inputs, validation failures and error paths are bounded, typed and actionable.",
          "required": true,
          "kind": "mechanical",
          "rules": [
            "backend-go",
            "security"
          ],
          "evidence_classes": [
            "e2e",
            "integration",
            "unit"
          ],
          "profiles": [
            "backend-review@1"
          ]
        },
        {
          "id": "backend-integration-impact",
          "description": "Providers, consumers and inter-component boundaries remain integrated.",
          "required": true,
          "kind": "mechanical",
          "evidence_classes": [
            "integration"
          ],
          "profiles": [
            "backend-review@1"
          ]
        },
        {
          "id": "backend-observability",
          "description": "Failures are diagnosable through bounded, non-sensitive logs, metrics or returned context.",
          "required": true,
          "kind": "mechanical",
          "rules": [
            "backend-go",
            "security"
          ],
          "evidence_classes": [
            "integration",
            "unit"
          ],
          "profiles": [
            "backend-review@1"
          ]
        },
        {
          "id": "compatibility",
          "description": "Public CLI, file and MCP contracts are compatible or explicitly migrated.",
          "required": true,
          "kind": "judgment",
          "profiles": [
            "spec-closeout@1"
          ]
        },
        {
          "id": "correctness",
          "description": "Functional and negative behavior is correct.",
          "required": true,
          "kind": "mechanical",
          "evidence_classes": [
            "build",
            "e2e",
            "integration",
            "unit"
          ],
          "profiles": [
            "spec-closeout@1"
          ]
        },
        {
          "id": "documentation",
          "description": "Operational docs, templates and scaffold match runtime behavior.",
          "required": true,
          "kind": "judgment",
          "rules": [
            "documentation-style"
          ],
          "profiles": [
            "spec-closeout@1"
          ]
        },
        {
          "id": "operability",
          "description": "Errors, explanations and remediation are actionable.",
          "required": true,
          "kind": "judgment",
          "profiles": [
            "spec-closeout@1"
          ]
        },
        {
          "id": "requirements",
          "description": "Every requirement has current, relevant evidence.",
          "required": true,
          "kind": "mechanical",
          "evidence_classes": [
            "e2e",
            "integration",
            "unit"
          ],
          "profiles": [
            "spec-closeout@1"
          ]
        },
        {
          "id": "scope",
          "description": "The implementation matches the approved spec scope.",
          "required": true,
          "kind": "judgment",